,Paper ID,Publishable,Conference,Reasoning
124,P125,1,EMNLP,"The paper introduces DISCOSENSE, a benchmark for commonsense reasoning using discourse connectives, which aligns with EMNLP's focus on natural language processing and computational linguistics. The paper's emphasis on evaluating language models' reasoning capabilities and the creation of a challenging dataset are relevant to the conference's themes. Unlike the reference paper which focuses on noun-noun compound interpretation, this paper tackles a different aspect of semantic understanding, specifically discourse connectives, making it a novel contribution to the field."
125,P126,1,TMLR,"This paper introduces a novel algorithm for causal inference using a single proxy variable and cross-moments, addressing limitations of existing methods that require multiple proxies or strong assumptions. The work includes theoretical guarantees and empirical validation, demonstrating superior performance in simulations and real-world applications. The focus on robust and efficient causal inference aligns well with the TMLR's emphasis on rigorous machine learning research. Unlike the reference papers which focus on min-max optimization and weak Minty solutions, this paper tackles a different problem within machine learning."
126,P127,1,KDD,"This paper fits KDD because it presents a novel deep learning model (MDCSA) for indoor localization using time-series sensor data, a core data mining task. It addresses challenges in multi-modal data fusion and temporal dynamics, and evaluates the model's performance in a real-world healthcare application. The paper's focus on extracting meaningful patterns from sensor data aligns with KDD's emphasis on knowledge discovery. Unlike the reference paper which focuses on medication detection in Parkinson's, this paper focuses on a more generalizable localization model."
127,P128,1,EMNLP,"This paper presents a novel end-to-end neural model for discourse deixis resolution in dialogue, achieving state-of-the-art results by extending a span-based coreference model with task-specific enhancements. The work focuses on a core NLP task, utilizing deep learning techniques and detailed empirical analysis, aligning well with EMNLP's focus on computational linguistics. Unlike the reference paper which explores transfer and multi-task learning for noun-noun compound interpretation, this paper focuses on discourse phenomena in dialogue."
128,P129,0,na,na
129,P130,0,na,na
130,P131,1,CVPR,"This paper presents a method for enhancing disentanglement in variational autoencoders by leveraging pretrained convolutional feature maps and fine-tuning them with auxiliary tasks. The approach is evaluated on the 2019 disentanglement challenge, demonstrating improved performance. This aligns with CVPR's focus on novel computer vision techniques and deep learning applications. Unlike the reference paper which focuses on action recognition in videos, this paper tackles representation learning for disentanglement, a core area in computer vision."
131,P132,0,na,na
132,P133,1,EMNLP,"This paper presents a novel sequence labeling approach for discontinuous constituent parsing, a core problem in computational linguistics, by encoding tree discontinuities as permutations. It explores various encoding methods and evaluates them using neural transducers. The focus on parsing and sequence labeling aligns well with EMNLP's emphasis on natural language processing techniques. Unlike the reference paper which focuses on noun-noun compound interpretation using transfer and multi-task learning, this paper tackles a different problem in parsing with a novel approach."
133,P134,0,na,na
134,P135,1,TMLR,"This paper presents a decentralized stochastic extragradient method for variational inequalities, with convergence analysis for strongly monotone, monotone, and non-monotone cases, and includes experiments on GAN training. The work fits TMLR due to its focus on theoretical machine learning, providing novel convergence rates and a practical algorithm for distributed optimization. Unlike the reference papers which focus on non-convex min-max problems with weak Minty solutions, this paper tackles decentralized settings and provides a more general analysis of variational inequalities."
